{
  "schemaVersion": "1.0.0",
  "projectId": "the-glitch-is-me",
  "shotCount": 16,
  "shots": [
    {
      "shotId": "shot-001",
      "chapterId": "digital-ocean",
      "order": 1,
      "title": "Suspended Droplet in the Digital Ocean",
      "narrativeIntent": "Open the film with a quiet impossible world that feels halfway between water and computation.",
      "prompt": "Extreme macro view of one heavy water droplet falling in near darkness, then slowing until it hangs motionless above a black reflective ocean. Inside the droplet, tiny violet signal patterns drift like plankton. The camera makes an almost imperceptible push forward while concentric ripples move below without an obvious source.",
      "negativePrompt": "camera shake, chaotic motion, abrupt internal cut, obvious stock footage look, inconsistent protagonist, costume change, face replacement, excessive glitch covering the subject, person, face, city skyline, literal circuit board",
      "sourceSectionHints": [
        "intro",
        "ambient opening",
        "low energy"
      ],
      "energyRange": [
        0.0,
        0.25
      ],
      "seed": 18031001,
      "required": true,
      "reuseModes": [
        "forward",
        "alternate-inpoint",
        "slow-push crop"
      ],
      "continuityTokens": [
        "wet black ocean",
        "violet signal plankton",
        "restrained amber glint"
      ],
      "continuityGroupIds": ["world-global", "digital-ocean"],
      "previousShotId": null,
      "continuationMode": "prompt-anchors",
      "reviewNotes": [
        "Droplet must remain coherent.",
        "No text-like symbols inside the droplet.",
        "Reserve empty space for the opening title added later in Resolve if desired."
      ]
    },
    {
      "shotId": "shot-002",
      "chapterId": "digital-ocean",
      "order": 2,
      "title": "The Siren Materializes",
      "narrativeIntent": "Introduce the recurring protagonist as a signal becoming human rather than a robot.",
      "prompt": "Wide underwater-like chamber with no visible walls. The Quantum Siren gradually assembles from silver mist, fine static and transparent ribbons of water, first as a distant silhouette and then as a fully coherent adult woman. Her long black hair and charcoal fabric float gently. She opens her eyes near the end while the camera performs a slow half orbit.",
      "negativePrompt": "camera shake, chaotic motion, abrupt internal cut, obvious stock footage look, inconsistent protagonist, costume change, face replacement, excessive glitch covering the subject, robot joints, metal body, superhero pose, dramatic mouth movement",
      "sourceSectionHints": [
        "intro",
        "vocal entrance",
        "awakening"
      ],
      "energyRange": [
        0.1,
        0.35
      ],
      "seed": 18031002,
      "required": true,
      "reuseModes": [
        "forward",
        "reverse for dream transition",
        "alternate crop"
      ],
      "continuityTokens": [
        "Quantum Siren",
        "charcoal floating fabric",
        "translucent signal fractures"
      ],
      "continuityGroupIds": ["world-global", "quantum-siren-identity", "digital-ocean"],
      "previousShotId": "shot-001",
      "continuationMode": "prompt-anchors",
      "reviewNotes": [
        "Adult appearance must be unambiguous.",
        "Face and costume become continuity reference for all later Siren shots."
      ]
    },
    {
      "shotId": "shot-003",
      "chapterId": "the-flicker",
      "order": 3,
      "title": "Cold Flickering Room",
      "narrativeIntent": "Show physical isolation inside an unstable digital frame.",
      "prompt": "A sparse cold room made from wet concrete and smoked glass flickers between solid reality and a precise wireframe absence. The Quantum Siren sits alone at the far edge of a narrow bed, almost motionless, while the light above her fails in slow irregular pulses. The camera tracks laterally behind translucent foreground glass, producing deep parallax and emotional distance.",
      "negativePrompt": "camera shake, chaotic motion, abrupt internal cut, obvious stock footage look, inconsistent protagonist, costume change, face replacement, excessive glitch covering the subject, cozy bedroom, furniture clutter, horror asylum, violent strobe",
      "sourceSectionHints": [
        "verse 1",
        "flicker",
        "intimate vocal"
      ],
      "energyRange": [
        0.2,
        0.45
      ],
      "seed": 18031003,
      "required": true,
      "reuseModes": [
        "forward",
        "alternate-inpoint",
        "horizontal crop push"
      ],
      "continuityTokens": [
        "Quantum Siren",
        "wet concrete room",
        "single failing practical light"
      ],
      "continuityGroupIds": ["world-global", "quantum-siren-identity", "flicker-room"],
      "previousShotId": "shot-002",
      "continuationMode": "prompt-anchors",
      "reviewNotes": [
        "Flicker must be slow enough for comfortable viewing.",
        "Keep face readable when visible."
      ]
    },
    {
      "shotId": "shot-004",
      "chapterId": "the-flicker",
      "order": 4,
      "title": "Impossible Smile Reconstruction",
      "narrativeIntent": "Visualize an emotionally remembered person without creating a second identifiable character.",
      "prompt": "In a black void, a graceful curve resembling a remembered smile forms from thousands of tiny luminous points and soft numerical geometry, but never becomes a complete human face. The Quantum Siren reaches toward it from the edge of frame; the shape ripples away before contact. Slow macro-to-medium rack focus, shallow depth of field, melancholy restraint.",
      "negativePrompt": "camera shake, chaotic motion, abrupt internal cut, obvious stock footage look, inconsistent protagonist, costume change, face replacement, excessive glitch covering the subject, readable numbers, complete second face, floating emoji, literal hologram interface",
      "sourceSectionHints": [
        "verse 1",
        "memory",
        "touch"
      ],
      "energyRange": [
        0.25,
        0.5
      ],
      "seed": 18031004,
      "required": true,
      "reuseModes": [
        "forward",
        "alternate-inpoint",
        "mirror in Resolve"
      ],
      "continuityTokens": [
        "violet point constellation",
        "Siren hand",
        "wet silver refraction"
      ],
      "continuityGroupIds": ["world-global", "quantum-siren-identity", "flicker-room"],
      "previousShotId": "shot-003",
      "continuationMode": "prompt-anchors",
      "reviewNotes": [
        "The smile remains abstract and non-identifying.",
        "Hand anatomy must be clean."
      ]
    },
    {
      "shotId": "shot-005",
      "chapterId": "unsolvable-distance",
      "order": 5,
      "title": "The Distance Equation",
      "narrativeIntent": "Turn emotional distance into impossible spatial mathematics during the first chorus.",
      "prompt": "An immense dark chamber is divided by floating translucent planes that fold into an impossible geometric distance. The Quantum Siren stands on one side while a warm human-shaped glow, intentionally faceless and abstract, remains unreachable on the other. Every step she takes causes the space between them to expand. The camera cranes upward to reveal the repeating geometry.",
      "negativePrompt": "camera shake, chaotic motion, abrupt internal cut, obvious stock footage look, inconsistent protagonist, costume change, face replacement, excessive glitch covering the subject, readable formulas, romantic embrace, detailed second person, sci-fi control room",
      "sourceSectionHints": [
        "chorus 1",
        "distance",
        "emotional lift"
      ],
      "energyRange": [
        0.45,
        0.75
      ],
      "seed": 18031005,
      "required": true,
      "reuseModes": [
        "forward",
        "alternate-inpoint",
        "speed ramp only in Resolve"
      ],
      "continuityTokens": [
        "Quantum Siren",
        "translucent impossible planes",
        "distant amber glow"
      ],
      "continuityGroupIds": ["world-global", "quantum-siren-identity", "distance-architecture"],
      "previousShotId": "shot-004",
      "continuationMode": "prompt-anchors",
      "reviewNotes": [
        "Keep the warm figure abstract.",
        "Geometry should expand clearly without becoming frenetic."
      ]
    },
    {
      "shotId": "shot-006",
      "chapterId": "unsolvable-distance",
      "order": 6,
      "title": "House Made of Bone",
      "narrativeIntent": "Create the chorus's strongest recurring architectural symbol.",
      "prompt": "A surreal cathedral-like house built from smooth bone-white arches floats above the digital ocean. The Quantum Siren walks through its open center as the structure slowly fractures into weightless ivory dust, exposing a starless void. The camera begins at human height and pulls back into a monumental wide shot while pieces drift in elegant slow motion.",
      "negativePrompt": "camera shake, chaotic motion, abrupt internal cut, obvious stock footage look, inconsistent protagonist, costume change, face replacement, excessive glitch covering the subject, gore, skeleton bodies, skull pile, haunted-house cliché, violent collapse",
      "sourceSectionHints": [
        "chorus 1",
        "house of bone",
        "release"
      ],
      "energyRange": [
        0.5,
        0.8
      ],
      "seed": 18031006,
      "required": true,
      "reuseModes": [
        "forward",
        "reverse for reconstruction",
        "alternate crop"
      ],
      "continuityTokens": [
        "bone-white arches",
        "Quantum Siren",
        "black digital ocean"
      ],
      "continuityGroupIds": ["world-global", "quantum-siren-identity", "distance-architecture"],
      "previousShotId": "shot-005",
      "continuationMode": "prompt-anchors",
      "reviewNotes": [